{
  "request_id": "exec_001",
  "status": "succeeded",
  "summary": "Executor generated experiment code, ran it, produced a figure/table, and wrote structured artifacts.",
  "artifacts": [
    {
      "artifact_id": "results_main",
      "path": "role/executor/workspaces/exec_001/results.json",
      "kind": "results",
      "description": "Generated-code experiment metrics.",
      "format": "json",
      "role": "primary_result",
      "created_by_executor": true
    },
    {
      "artifact_id": "tests_main",
      "path": "role/executor/workspaces/exec_001/tests.json",
      "kind": "tests",
      "description": "Validation checks mapped to planner success criteria.",
      "format": "json",
      "role": "audit",
      "created_by_executor": true
    },
    {
      "artifact_id": "environment_main",
      "path": "role/executor/workspaces/exec_001/environment.json",
      "kind": "environment",
      "description": "Python, package, platform, and seed metadata.",
      "format": "json",
      "role": "audit",
      "created_by_executor": true
    },
    {
      "artifact_id": "artifacts_manifest",
      "path": "role/executor/workspaces/exec_001/artifacts.json",
      "kind": "metadata",
      "description": "Manifest of generated executor artifacts.",
      "format": "json",
      "role": "audit",
      "created_by_executor": true
    },
    {
      "artifact_id": "llm_plan",
      "path": "role/executor/workspaces/exec_001/work/llm_plan.json",
      "kind": "metadata",
      "description": "LLM or fallback execution plan.",
      "format": "json",
      "role": "audit",
      "created_by_executor": true
    },
    {
      "artifact_id": "source_generated_experiment",
      "path": "role/executor/workspaces/exec_001/work/generated_experiment.py",
      "kind": "source",
      "description": "Generated experiment code executed by the executor.",
      "format": "py",
      "role": "audit",
      "created_by_executor": true
    },
    {
      "artifact_id": "fig_attempt_01_generated_diagnostic",
      "path": "role/executor/workspaces/exec_001/figures/attempt_01_generated_diagnostic.svg",
      "kind": "figure",
      "description": "Generated experiment diagnostic figure.",
      "format": "svg",
      "role": "diagnostic",
      "created_by_executor": true
    },
    {
      "artifact_id": "table_attempt_01_generated_metrics",
      "path": "role/executor/workspaces/exec_001/tables/attempt_01_generated_metrics.csv",
      "kind": "table",
      "description": "Generated experiment metrics table.",
      "format": "csv",
      "role": "supporting",
      "created_by_executor": true
    },
    {
      "artifact_id": "notes_main",
      "path": "role/executor/workspaces/exec_001/notes.md",
      "kind": "notes",
      "description": "Short interpretation notes and limitations.",
      "format": "md",
      "role": "supporting",
      "created_by_executor": true
    }
  ],
  "validation": {
    "overall": "passed",
    "checks": [
      {
        "criterion_id": "crit_results_json",
        "status": "passed",
        "evidence": "results.json contains baseline, attempts, and best_attempt keys.",
        "artifact_refs": ["results_main"]
      },
      {
        "criterion_id": "crit_metric_threshold",
        "status": "passed",
        "evidence": "Generated experiment reported a best objective value greater than or equal to its mean baseline.",
        "metric_value": {
          "baseline": 0.64125,
          "best_attempt": 0.83
        },
        "artifact_refs": ["results_main", "table_attempt_01_generated_metrics"]
      },
      {
        "criterion_id": "crit_diagnostic_figure",
        "status": "passed",
        "evidence": "One diagnostic figure was written under figures/.",
        "artifact_refs": ["fig_attempt_01_generated_diagnostic"]
      }
    ]
  },
  "attempts": [
    {
      "attempt_id": "attempt_01",
      "status": "succeeded",
      "description": "Generated experiment code was executed inside the executor workspace.",
      "artifact_refs": ["results_main", "llm_plan", "source_generated_experiment", "fig_attempt_01_generated_diagnostic", "table_attempt_01_generated_metrics"]
    }
  ],
  "policy_observance": {
    "browser_used": false,
    "sessions_spawned": false,
    "external_post_performed": false,
    "write_scope_respected": true,
    "notes": "All writes stayed under role/executor/workspaces/exec_001."
  },
  "limitations": [
    "This is still an MVP integration loop, not a full sandbox.",
    "Generated code is constrained by prompt and workspace checks, but should be sandboxed more strongly before untrusted use."
  ],
  "recommended_planner_next_steps": [
    "Use this response shape to test planner parsing.",
    "Replace the toy execution with a planner-approved real experiment hook."
  ]
}

